key,instantiation-moment,heading,summary,start-date,end-date,price,link
offer-01,2020/01/05 00:00,Proteina Descuento!!!!,Obten el segundo paquete con un 20% de descuento Obten el segundo paquete con un 20% de descuento,2020/01/05 00:00,2020/01/15 00:00,EUR 18.75,
offer-02,50/02/05 17:54,"Oferta en libretas, pero libretas bonitas, de las guay",Todas las libretas a 1€,50/02/05 00:00,50/02/13 00:00,EUR 1.00,
offer-03,2022/06/30 00:00,¿Mes Gratis?,Durante el principio de marzo no pagarás matricula y el primer mes,2022/06/30 00:00,2022/07/20 00:00,GBP 50.00,
offer-04,2016/12/20 00:00,Steam. Rebajas. Navidad!,Disfruta de grandes titulos rebajados,2016/12/21 00:00,2017/01/20 00:00,USD 25.30,
offer-05,2020/05/05 00:00,U,O,2020/05/05 00:00,2020/05/10 00:00,"THB 100,000.00",
